{
  "artifact_type": "EvidenceRadar_State",
  "base_state_sha256": "4d7b322f6e2e219af749a8f08280d0f459be284b600dac95b23b7986dab9200e",
  "dedupe_priority": [
    "doi",
    "pmid",
    "pmcid",
    "arxiv_id",
    "anthology_id",
    "openalex_id",
    "normalized_title"
  ],
  "execution_lane": "github_actions",
  "generated_at": "2026-08-09T14:26:54.038112+09:00",
  "history_note": "Canonical prior state was loaded.",
  "history_status": "STATE_HISTORY_INCOMPLETE",
  "last_run_id": "github-actions-20260809T142115+0900",
  "notes": [
    "Automated GitHub lane records only event candidates whose source page was accessible."
  ],
  "notified_events": [
    {
      "confidence": "provider_metadata",
      "event_id": "event:dbe8f42489cadce21730a5f84bfe6d3aa854a88186547d8461e562194c6efbe9",
      "event_type": "first_formal_indexing",
      "notified_at": "2026-08-09T14:26:54.038112+09:00",
      "occurred_at": "2026-08-07",
      "precision": "date",
      "source": "PubMed",
      "source_field": "PubMedData/History[pubmed]",
      "source_url": "https://pubmed.ncbi.nlm.nih.gov/42566592/",
      "work_id": "doi:10.1097/md.0000000000050023"
    },
    {
      "confidence": "provider_metadata",
      "event_id": "event:f2523418e629494b813d38a3a2de9120b57b06f0021cbe363a46e8aafd813a72",
      "event_type": "first_formal_indexing",
      "notified_at": "2026-08-09T14:25:40.089016+09:00",
      "occurred_at": "2026-08-07",
      "precision": "date",
      "source": "PubMed",
      "source_field": "PubMedData/History[pubmed]",
      "source_url": "https://pubmed.ncbi.nlm.nih.gov/42566610/",
      "work_id": "doi:10.1097/md.0000000000050133"
    }
  ],
  "parent_run_ids": [
    "github-actions-20260809T142115+0900"
  ],
  "protocol_commit": "fbd50cb9126d3e5bf8d50892fef1b5f171b3518e",
  "schema_version": "1.0",
  "timezone": "Asia/Tokyo",
  "works": [
    {
      "category": "clinical_medicine",
      "first_seen_at": "2026-08-09T14:26:54.038112+09:00",
      "identifiers": {
        "doi": "10.1097/md.0000000000050023",
        "pmid": "42566592"
      },
      "is_preprint": false,
      "last_seen_at": "2026-08-09T14:26:54.038112+09:00",
      "normalized_title": "efficacy and safety of first line immune checkpoint inhibitors combinations for extensive stage small cell lung cancer a systematic review and network meta analysis",
      "notified_event_ids": [
        "event:dbe8f42489cadce21730a5f84bfe6d3aa854a88186547d8461e562194c6efbe9"
      ],
      "open_access": false,
      "seen_count": 1,
      "source_urls": [
        "https://www.ovid.com/jnls/md-journal/fulltext/10.1097/md.0000000000050023~efficacy-and-safety-of-first-line-immune-checkpoint"
      ],
      "streams": [
        "clinical_medicine"
      ],
      "title": "Efficacy and safety of first-line immune checkpoint inhibitors combinations for extensive-stage small-cell lung cancer: A systematic review and network meta-analysis.",
      "work_id": "doi:10.1097/md.0000000000050023"
    },
    {
      "category": "clinical_medicine",
      "first_seen_at": "2026-08-09T14:25:40.089016+09:00",
      "identifiers": {
        "doi": "10.1097/md.0000000000050133",
        "pmid": "42566610"
      },
      "is_preprint": false,
      "last_seen_at": "2026-08-09T14:25:40.089016+09:00",
      "normalized_title": "efficacy and safety of acupuncture treatment for depression a systematic review and meta analysis",
      "notified_event_ids": [
        "event:f2523418e629494b813d38a3a2de9120b57b06f0021cbe363a46e8aafd813a72"
      ],
      "open_access": false,
      "seen_count": 1,
      "source_urls": [
        "https://www.ovid.com/jnls/md-journal/fulltext/10.1097/md.0000000000050133~efficacy-and-safety-of-acupuncture-treatment-for-depression"
      ],
      "streams": [
        "clinical_medicine"
      ],
      "title": "Efficacy and safety of acupuncture treatment for depression: A systematic review and meta-analysis.",
      "work_id": "doi:10.1097/md.0000000000050133"
    }
  ]
}
