{
  "artifact_type": "EvidenceRadar_State",
  "base_state_sha256": "7cdf8c0e2e0f0d4872f3333b146d989dbe2badc610feed55cadceba652883301",
  "dedupe_priority": [
    "doi",
    "pmid",
    "pmcid",
    "arxiv_id",
    "anthology_id",
    "openalex_id",
    "normalized_title"
  ],
  "execution_lane": "github_actions",
  "generated_at": "2026-08-09T14:35:26.251657+09:00",
  "history_note": "Canonical prior state was loaded.",
  "history_status": "STATE_HISTORY_INCOMPLETE",
  "last_run_id": "github-actions-20260809T143450+0900",
  "notes": [
    "Automated GitHub lane records only event candidates whose source page was accessible."
  ],
  "notified_events": [
    {
      "confidence": "publisher_supplied_citation",
      "event_id": "event:268333a2e2cfbd277572ac1091689c989608903b2fb654401c31f82c8b257afd",
      "event_type": "version_of_record_first_online",
      "notified_at": "2026-08-09T09:21:54.070002+09:00",
      "occurred_at": "2026-08-07",
      "precision": "date",
      "source": "PubMed",
      "source_field": "Article/ArticleDate",
      "source_url": "https://pubmed.ncbi.nlm.nih.gov/42566718/",
      "work_id": "doi:10.2196/89215"
    },
    {
      "confidence": "publisher_supplied_citation",
      "event_id": "event:abb130421e50e372237c9700e9b96e42e38da9dbe8fe0c5743efdb9326c50ff3",
      "event_type": "version_of_record_first_online",
      "notified_at": "2026-08-09T09:21:54.070002+09:00",
      "occurred_at": "2026-08-07",
      "precision": "date",
      "source": "PubMed",
      "source_field": "Article/ArticleDate",
      "source_url": "https://pubmed.ncbi.nlm.nih.gov/42565815/",
      "work_id": "doi:10.2196/89321"
    },
    {
      "confidence": "provider_metadata",
      "event_id": "event:dbe8f42489cadce21730a5f84bfe6d3aa854a88186547d8461e562194c6efbe9",
      "event_type": "first_formal_indexing",
      "notified_at": "2026-08-09T14:35:26.251657+09:00",
      "occurred_at": "2026-08-07",
      "precision": "date",
      "source": "PubMed",
      "source_field": "PubMedData/History[pubmed]",
      "source_url": "https://pubmed.ncbi.nlm.nih.gov/42566592/",
      "work_id": "doi:10.1097/md.0000000000050023"
    },
    {
      "confidence": "provider_metadata",
      "event_id": "event:f2523418e629494b813d38a3a2de9120b57b06f0021cbe363a46e8aafd813a72",
      "event_type": "first_formal_indexing",
      "notified_at": "2026-08-09T09:21:54.070002+09:00",
      "occurred_at": "2026-08-07",
      "precision": "date",
      "source": "PubMed",
      "source_field": "PubMedData/History[pubmed]",
      "source_url": "https://pubmed.ncbi.nlm.nih.gov/42566610/",
      "work_id": "doi:10.1097/md.0000000000050133"
    }
  ],
  "parent_run_ids": [
    "github-actions-20260809T092119+0900"
  ],
  "protocol_commit": "e64629fea01243482af1ab89a95ffb6c1ddf3b92",
  "schema_version": "1.0",
  "timezone": "Asia/Tokyo",
  "works": [
    {
      "category": "clinical_medicine",
      "first_seen_at": "2026-08-09T14:35:26.251657+09:00",
      "identifiers": {
        "doi": "10.1097/md.0000000000050023",
        "pmid": "42566592"
      },
      "is_preprint": false,
      "last_seen_at": "2026-08-09T14:35:26.251657+09:00",
      "normalized_title": "efficacy and safety of first line immune checkpoint inhibitors combinations for extensive stage small cell lung cancer a systematic review and network meta analysis",
      "notified_event_ids": [
        "event:dbe8f42489cadce21730a5f84bfe6d3aa854a88186547d8461e562194c6efbe9"
      ],
      "open_access": false,
      "seen_count": 1,
      "source_urls": [
        "https://www.ovid.com/jnls/md-journal/fulltext/10.1097/md.0000000000050023~efficacy-and-safety-of-first-line-immune-checkpoint"
      ],
      "streams": [
        "clinical_medicine"
      ],
      "title": "Efficacy and safety of first-line immune checkpoint inhibitors combinations for extensive-stage small-cell lung cancer: A systematic review and network meta-analysis.",
      "work_id": "doi:10.1097/md.0000000000050023"
    },
    {
      "category": "clinical_medicine",
      "first_seen_at": "2026-08-09T09:21:54.070002+09:00",
      "identifiers": {
        "doi": "10.1097/md.0000000000050133",
        "pmid": "42566610"
      },
      "is_preprint": false,
      "last_seen_at": "2026-08-09T09:21:54.070002+09:00",
      "normalized_title": "efficacy and safety of acupuncture treatment for depression a systematic review and meta analysis",
      "notified_event_ids": [
        "event:f2523418e629494b813d38a3a2de9120b57b06f0021cbe363a46e8aafd813a72"
      ],
      "open_access": false,
      "seen_count": 1,
      "source_urls": [
        "https://www.ovid.com/jnls/md-journal/fulltext/10.1097/md.0000000000050133~efficacy-and-safety-of-acupuncture-treatment-for-depression"
      ],
      "streams": [
        "clinical_medicine"
      ],
      "title": "Efficacy and safety of acupuncture treatment for depression: A systematic review and meta-analysis.",
      "work_id": "doi:10.1097/md.0000000000050133"
    },
    {
      "category": "clinical_medicine",
      "first_seen_at": "2026-08-09T09:21:54.070002+09:00",
      "identifiers": {
        "doi": "10.2196/89215",
        "pmid": "42566718"
      },
      "is_preprint": false,
      "last_seen_at": "2026-08-09T09:21:54.070002+09:00",
      "normalized_title": "effectiveness of a brief internet based workplace training program to support help seeking for mental ill health cluster randomized controlled trial",
      "notified_event_ids": [
        "event:268333a2e2cfbd277572ac1091689c989608903b2fb654401c31f82c8b257afd"
      ],
      "open_access": false,
      "seen_count": 1,
      "source_urls": [
        "https://www.jmir.org/2026/1/e89215"
      ],
      "streams": [
        "clinical_medicine"
      ],
      "title": "Effectiveness of a Brief Internet-Based Workplace Training Program to Support Help Seeking for Mental Ill-Health: Cluster Randomized Controlled Trial.",
      "work_id": "doi:10.2196/89215"
    },
    {
      "category": "clinical_medicine",
      "first_seen_at": "2026-08-09T09:21:54.070002+09:00",
      "identifiers": {
        "doi": "10.2196/89321",
        "pmid": "42565815"
      },
      "is_preprint": false,
      "last_seen_at": "2026-08-09T09:21:54.070002+09:00",
      "normalized_title": "effectiveness of interactive remote rehabilitation after total knee arthroplasty systematic review and meta analysis of randomized controlled trials",
      "notified_event_ids": [
        "event:abb130421e50e372237c9700e9b96e42e38da9dbe8fe0c5743efdb9326c50ff3"
      ],
      "open_access": false,
      "seen_count": 1,
      "source_urls": [
        "https://www.jmir.org/2026/1/e89321"
      ],
      "streams": [
        "clinical_medicine"
      ],
      "title": "Effectiveness of Interactive Remote Rehabilitation After Total Knee Arthroplasty: Systematic Review and Meta-Analysis of Randomized Controlled Trials.",
      "work_id": "doi:10.2196/89321"
    }
  ]
}
